{
  "$schema": "https://json-schema.org/draft/2020-12/schema",
  "$id": "https://artist-generation.local/schemas/sound-medium-plan.schema.json",
  "title": "SoundMediumPlan",
  "type": "object",
  "additionalProperties": false,
  "allOf": [
    {
      "if": {
        "required": ["medium_output_shape_recommendation"],
        "properties": {
          "medium_output_shape_recommendation": {
            "properties": {
              "accepted_shape": { "const": "song" }
            }
          }
        }
      },
      "then": { "properties": { "sound_work_type": { "const": "song" } } }
    },
    {
      "if": {
        "required": ["medium_output_shape_recommendation"],
        "properties": {
          "medium_output_shape_recommendation": {
            "properties": {
              "accepted_shape": { "const": "instrumental_track" }
            }
          }
        }
      },
      "then": { "properties": { "sound_work_type": { "const": "instrumental_track" } } }
    },
    {
      "if": {
        "required": ["medium_output_shape_recommendation"],
        "properties": {
          "medium_output_shape_recommendation": {
            "properties": {
              "accepted_shape": { "const": "ambient_soundscape" }
            }
          }
        }
      },
      "then": { "properties": { "sound_work_type": { "const": "ambient_soundscape" } } }
    },
    {
      "if": {
        "required": ["medium_output_shape_recommendation"],
        "properties": {
          "medium_output_shape_recommendation": {
            "properties": {
              "accepted_shape": { "const": "cinematic_score" }
            }
          }
        }
      },
      "then": { "properties": { "sound_work_type": { "const": "cinematic_score" } } }
    },
    {
      "if": {
        "required": ["medium_output_shape_recommendation"],
        "properties": {
          "medium_output_shape_recommendation": {
            "properties": {
              "accepted_shape": { "const": "spoken_word_bed" }
            }
          }
        }
      },
      "then": { "properties": { "sound_work_type": { "const": "spoken_word_bed" } } }
    },
    {
      "if": {
        "required": ["medium_output_shape_recommendation"],
        "properties": {
          "medium_output_shape_recommendation": {
            "properties": {
              "accepted_shape": { "const": "ritual_audio" }
            }
          }
        }
      },
      "then": { "properties": { "sound_work_type": { "const": "ritual_audio" } } }
    },
    {
      "if": {
        "required": ["medium_output_shape_recommendation"],
        "properties": {
          "medium_output_shape_recommendation": {
            "properties": {
              "accepted_shape": { "const": "sound_design_piece" }
            }
          }
        }
      },
      "then": { "properties": { "sound_work_type": { "const": "sound_design_piece" } } }
    },
    {
      "if": {
        "required": ["medium_output_shape_recommendation"],
        "properties": {
          "medium_output_shape_recommendation": {
            "properties": {
              "accepted_shape": { "const": "sonic_logo" }
            }
          }
        }
      },
      "then": { "properties": { "sound_work_type": { "const": "sonic_logo" } } }
    },
    {
      "if": {
        "required": ["medium_output_shape_recommendation"],
        "properties": {
          "medium_output_shape_recommendation": {
            "properties": {
              "accepted_shape": { "const": "sound_sequence" }
            }
          }
        }
      },
      "then": {
        "properties": {
          "sequence_plan": {
            "properties": {
              "is_sequence": { "const": true }
            }
          }
        }
      }
    }
  ],
  "required": [
    "sound_medium_plan_id",
    "source_id",
    "artist_meaning_id",
    "transformation_brief_id",
    "beat_plan_id",
    "target_media_type",
    "story_mode",
    "workflow_scale_routing",
    "sound_work_type",
    "sonic_concept_direction",
    "genre_direction",
    "tempo_groove_direction",
    "vocal_lyric_policy",
    "arrangement_direction",
    "sonic_dynamics",
    "sequence_plan",
    "gates",
    "review_requirements",
    "traceability_summary"
  ],
  "properties": {
    "sound_medium_plan_id": { "type": "string", "pattern": "^smp_[a-zA-Z0-9_-]+$" },
    "source_id": { "type": "string", "pattern": "^src_[a-zA-Z0-9_-]+$" },
    "artist_meaning_id": { "type": "string", "pattern": "^meaning_[a-zA-Z0-9_-]+$" },
    "transformation_brief_id": { "type": "string", "pattern": "^tb_[a-zA-Z0-9_-]+$" },
    "beat_plan_id": { "type": "string", "pattern": "^bp_[a-zA-Z0-9_-]+$" },
    "target_media_type": { "type": "string", "const": "sound" },
    "story_mode": { "$ref": "#/$defs/story_mode" },
    "workflow_scale_routing": { "$ref": "#/$defs/workflow_scale_routing" },
    "medium_output_shape_recommendation": { "$ref": "#/$defs/medium_output_shape_recommendation" },
    "sound_work_type": {
      "type": "string",
      "enum": ["song", "instrumental_track", "ambient_soundscape", "cinematic_score", "spoken_word_bed", "ritual_audio", "sound_design_piece", "sonic_logo"]
    },
    "sonic_concept_direction": {
      "type": "object",
      "additionalProperties": false,
      "required": ["selection_method", "primary_sonic_concept", "target_sonic_engine", "confirmation_status", "rationale", "avoid"],
      "properties": {
        "selection_method": { "type": "string", "enum": ["artist_specified", "sonic_concept_gate", "agent_recommended"] },
        "primary_sonic_concept": { "type": "string" },
        "target_sonic_engine": { "type": "string" },
        "confirmation_status": { "type": "string", "enum": ["artist_specified", "confirmed", "unconfirmed"] },
        "rationale": { "type": "string" },
        "avoid": { "type": "array", "items": { "type": "string" } }
      }
    },
    "genre_direction": {
      "type": "object",
      "additionalProperties": false,
      "required": ["selection_method", "primary_genre", "modifiers", "production_style", "confirmation_status", "rationale", "avoid"],
      "properties": {
        "selection_method": { "type": "string", "enum": ["artist_specified", "genre_gate", "agent_recommended"] },
        "primary_genre": { "type": "string" },
        "modifiers": { "type": "array", "maxItems": 4, "items": { "type": "string" } },
        "production_style": { "type": "string" },
        "confirmation_status": { "type": "string", "enum": ["artist_specified", "confirmed", "unconfirmed"] },
        "rationale": { "type": "string" },
        "avoid": { "type": "array", "items": { "type": "string" } }
      }
    },
    "tempo_groove_direction": {
      "type": "object",
      "additionalProperties": false,
      "required": ["selection_method", "bpm", "bpm_range", "tempo_feel", "meter", "groove_feel", "rationale"],
      "properties": {
        "selection_method": { "type": "string", "enum": ["artist_specified", "tempo_groove_gate", "agent_recommended"] },
        "bpm": { "type": ["number", "null"], "minimum": 1 },
        "bpm_range": {
          "type": "object",
          "additionalProperties": false,
          "required": ["min", "max"],
          "properties": {
            "min": { "type": ["number", "null"], "minimum": 1 },
            "max": { "type": ["number", "null"], "minimum": 1 }
          }
        },
        "tempo_feel": { "type": "string" },
        "meter": { "type": "string" },
        "groove_feel": { "type": "string" },
        "rationale": { "type": "string" }
      }
    },
    "vocal_lyric_policy": {
      "type": "object",
      "additionalProperties": false,
      "required": ["lyrics_mode", "requires_lyrics_draft", "lyrics_approval_status", "vocal_direction", "rights_notes", "rationale"],
      "properties": {
        "lyrics_mode": { "type": "string", "enum": ["instrumental", "source_text_verbatim", "source_text_adapted", "new_lyrics", "spoken_word", "phonetic_vocals"] },
        "requires_lyrics_draft": { "type": "boolean" },
        "lyrics_approval_status": { "type": "string", "enum": ["not_required", "draft_required", "drafted", "approved", "unconfirmed"] },
        "vocal_direction": { "type": "string" },
        "rights_notes": { "type": "string" },
        "rationale": { "type": "string" }
      }
    },
    "arrangement_direction": {
      "type": "object",
      "additionalProperties": false,
      "required": ["target_duration_seconds", "section_strategy", "dynamic_arc", "ending_behavior"],
      "properties": {
        "target_duration_seconds": { "type": "integer", "minimum": 1 },
        "section_strategy": { "type": "array", "minItems": 1, "items": { "$ref": "#/$defs/section_strategy" } },
        "dynamic_arc": { "type": "string" },
        "ending_behavior": { "type": "string" }
      }
    },
    "sonic_dynamics": {
      "type": "object",
      "additionalProperties": false,
      "required": ["active_sonic_tensions", "genre_sonic_conflicts"],
      "properties": {
        "active_sonic_tensions": {
          "type": "array",
          "minItems": 1,
          "maxItems": 8,
          "items": { "$ref": "#/$defs/tension_pair_summary" }
        },
        "genre_sonic_conflicts": {
          "type": "array",
          "items": {
            "type": "object",
            "additionalProperties": false,
            "required": ["conflict", "adaptation", "requires_artist_approval"],
            "properties": {
              "conflict": { "type": "string" },
              "adaptation": { "type": "string" },
              "requires_artist_approval": { "type": "boolean" }
            }
          }
        }
      }
    },
    "sequence_plan": {
      "type": "object",
      "additionalProperties": false,
      "required": ["is_sequence", "requires_sequence_approval", "sequence_summary"],
      "properties": {
        "is_sequence": { "type": "boolean" },
        "requires_sequence_approval": { "type": "boolean" },
        "sequence_summary": { "type": "string" }
      }
    },
    "gates": {
      "type": "object",
      "additionalProperties": false,
      "required": ["sound_work_type_gate", "sonic_concept_gate", "genre_production_gate", "tempo_groove_gate", "vocal_lyric_gate", "arrangement_form_gate"],
      "properties": {
        "sound_work_type_gate": { "$ref": "#/$defs/gate_status" },
        "sonic_concept_gate": { "$ref": "#/$defs/gate_status" },
        "genre_production_gate": { "$ref": "#/$defs/gate_status" },
        "tempo_groove_gate": { "$ref": "#/$defs/gate_status" },
        "vocal_lyric_gate": { "$ref": "#/$defs/gate_status" },
        "arrangement_form_gate": { "$ref": "#/$defs/gate_status" }
      }
    },
    "review_requirements": {
      "type": "object",
      "additionalProperties": false,
      "required": ["beat_reviewer_required", "sound_critic_required", "prompt_critic_required"],
      "properties": {
        "beat_reviewer_required": { "type": "boolean" },
        "sound_critic_required": { "type": "boolean", "const": true },
        "prompt_critic_required": { "type": "boolean", "const": true }
      }
    },
    "traceability_summary": {
      "type": "array",
      "minItems": 1,
      "items": { "$ref": "#/$defs/traceability_note" }
    }
  },
  "$defs": {
    "story_mode": {
      "type": "string",
      "enum": ["single_beat", "beat_pair", "three_part_sequence", "sequence", "scene", "arc", "world"]
    },
    "gate_status": {
      "type": "string",
      "enum": ["not_started", "in_progress", "complete", "skipped", "unconfirmed"]
    },
    "sound_output_shape": {
      "type": "string",
      "enum": ["song", "instrumental_track", "ambient_soundscape", "cinematic_score", "spoken_word_bed", "ritual_audio", "sound_design_piece", "sonic_logo", "sound_sequence"]
    },
    "workflow_scale_level": {
      "type": "string",
      "enum": ["compact_artifact", "structured_single_artifact", "cumulative_work", "full_long_form_project"]
    },
    "workflow_scale_support": {
      "type": "string",
      "enum": [
        "core_pipeline",
        "medium_section_plan",
        "cultural_format_structure",
        "long_work_stewardship",
        "long_work_parts",
        "long_work_readiness",
        "long_work_checkpoints",
        "stewardship_views",
        "plot_tracker",
        "character_sheets",
        "world_building",
        "chapter_or_scene_briefs",
        "style_guide",
        "extraction_verification",
        "synthesis_checkpoints",
        "publishing_or_completion_audit",
        "collection_coherence_review"
      ]
    },
    "workflow_scale_trigger_signal": {
      "type": "string",
      "enum": [
        "artist_requested_compact_output",
        "artist_requested_long_form",
        "artist_requested_sequence_or_series",
        "single_artifact_can_hold_movement",
        "internal_sections_or_movements_needed",
        "dependent_parts_needed",
        "durable_canon_needed",
        "recurring_characters_needed",
        "world_rules_or_timeline_needed",
        "subplots_or_open_threads_needed",
        "voice_or_style_continuity_needed",
        "extraction_verification_needed",
        "synthesis_or_batch_generation_needed",
        "publication_or_completion_audit_needed",
        "collection_without_sequence"
      ]
    },
    "workflow_scale_routing": {
      "type": "object",
      "additionalProperties": false,
      "required": ["scale_level", "rationale", "trigger_signals", "recommended_supports", "activated_supports", "skipped_supports", "reroute_triggers"],
      "properties": {
        "scale_level": { "$ref": "#/$defs/workflow_scale_level" },
        "rationale": { "type": "string", "minLength": 1 },
        "trigger_signals": {
          "type": "array",
          "minItems": 1,
          "items": { "$ref": "#/$defs/workflow_scale_trigger_signal" }
        },
        "recommended_supports": {
          "type": "array",
          "items": { "$ref": "#/$defs/workflow_scale_support" }
        },
        "activated_supports": {
          "type": "array",
          "minItems": 1,
          "items": { "$ref": "#/$defs/workflow_scale_support" }
        },
        "skipped_supports": {
          "type": "array",
          "items": { "$ref": "#/$defs/workflow_scale_support" }
        },
        "reroute_triggers": {
          "type": "array",
          "items": { "type": "string", "minLength": 1 }
        }
      }
    },
    "medium_output_shape_recommendation": {
      "type": "object",
      "additionalProperties": false,
      "required": [
        "requested_shape",
        "recommended_shape",
        "accepted_shape",
        "rationale",
        "alternatives_considered",
        "tradeoffs",
        "conflict"
      ],
      "properties": {
        "requested_shape": { "type": ["string", "null"], "minLength": 1 },
        "recommended_shape": { "$ref": "#/$defs/sound_output_shape" },
        "accepted_shape": { "$ref": "#/$defs/sound_output_shape" },
        "rationale": { "type": "string", "minLength": 1 },
        "alternatives_considered": {
          "type": "array",
          "items": { "$ref": "#/$defs/sound_output_shape" }
        },
        "tradeoffs": {
          "type": "array",
          "items": { "type": "string", "minLength": 1 }
        },
        "conflict": { "$ref": "#/$defs/medium_output_shape_conflict" }
      }
    },
    "medium_output_shape_conflict": {
      "type": "object",
      "additionalProperties": false,
      "required": ["has_conflict", "conflict_summary", "resolution", "gate_decision_id"],
      "properties": {
        "has_conflict": { "type": "boolean" },
        "conflict_summary": { "type": ["string", "null"], "minLength": 1 },
        "resolution": {
          "type": "string",
          "enum": ["not_needed", "accepted_recommendation", "kept_requested_shape", "revised_shape", "proceeded_unconfirmed", "waived"]
        },
        "gate_decision_id": { "type": ["string", "null"], "pattern": "^gate_[a-zA-Z0-9_-]+$" }
      }
    },
    "section_strategy": {
      "type": "object",
      "additionalProperties": false,
      "required": ["section_name", "beat_id", "section_function", "tension_role"],
      "properties": {
        "section_name": { "type": "string" },
        "beat_id": { "type": "string", "pattern": "^beat_[a-zA-Z0-9_-]+$" },
        "section_function": { "type": "string" },
        "tension_role": { "type": "string" }
      }
    },
    "tension_pair_summary": {
      "type": "object",
      "additionalProperties": false,
      "required": ["name", "tension_intensity", "translation_notes"],
      "properties": {
        "name": { "type": "string" },
        "tension_intensity": { "type": "number", "minimum": 0, "maximum": 1 },
        "translation_notes": { "type": "array", "items": { "type": "string" } }
      }
    },
    "traceability_note": {
      "type": "object",
      "additionalProperties": false,
      "required": ["source_type", "source_ref", "note"],
      "properties": {
        "source_type": {
          "type": "string",
          "enum": ["artist_meaning", "reference_evidence", "transformation_brief", "beat_plan", "beat", "tension_point", "gate_decision"]
        },
        "source_ref": { "type": "string" },
        "note": { "type": "string" }
      }
    }
  }
}
