{
  "sound_medium_plan_id": "smp_door_left_lit_calibration",
  "source_id": "src_door_left_lit",
  "artist_meaning_id": "meaning_door_left_lit",
  "transformation_brief_id": "tb_door_left_lit",
  "beat_plan_id": "bp_door_left_lit_album",
  "target_media_type": "sound",
  "story_mode": "single_beat",
  "workflow_scale_routing": {
    "scale_level": "structured_single_artifact",
    "rationale": "One sound artifact can hold the movement through internal arrangement sections without becoming a sound sequence.",
    "trigger_signals": [
      "internal_sections_or_movements_needed",
      "single_artifact_can_hold_movement"
    ],
    "recommended_supports": [],
    "activated_supports": [
      "core_pipeline",
      "medium_section_plan"
    ],
    "skipped_supports": [
      "long_work_stewardship",
      "long_work_parts",
      "long_work_readiness",
      "long_work_checkpoints"
    ],
    "reroute_triggers": [
      "Artist requests dependent parts, a sequence or series, durable canon, or long-form drafting across sessions."
    ]
  },
  "sound_work_type": "song",
  "sonic_concept_direction": {
    "selection_method": "agent_recommended",
    "primary_sonic_concept": "an intimate nocturnal song where room tone, breath, and a fragile piano motif carry the unresolved threshold",
    "target_sonic_engine": "sparse piano, close vocal, low sub pressure, soft rain-like texture, and unresolved harmonic color",
    "confirmation_status": "confirmed",
    "rationale": "A close song form can preserve the human threshold while sparse sound makes absence active.",
    "avoid": [
      "large triumphant chorus",
      "literal haunted-house sound effects",
      "upbeat dance resolution"
    ]
  },
  "genre_direction": {
    "selection_method": "agent_recommended",
    "primary_genre": "alt-R&B",
    "modifiers": [
      "downtempo",
      "ambient pop",
      "intimate",
      "sparse"
    ],
    "production_style": "minimal nocturnal studio production",
    "confirmation_status": "confirmed",
    "rationale": "Alt-R&B supports close vocal tenderness while downtempo ambient production preserves threat and absence.",
    "avoid": [
      "EDM drop",
      "arena pop",
      "bright acoustic folk"
    ]
  },
  "tempo_groove_direction": {
    "selection_method": "agent_recommended",
    "bpm": 82,
    "bpm_range": {
      "min": 78,
      "max": 86
    },
    "tempo_feel": "slow-burning and suspended",
    "meter": "4/4",
    "groove_feel": "laid-back half-time pulse",
    "rationale": "A slow tempo preserves stillness while the pulse keeps the decision physically present."
  },
  "vocal_lyric_policy": {
    "lyrics_mode": "new_lyrics",
    "requires_lyrics_draft": true,
    "lyrics_approval_status": "approved",
    "vocal_direction": "close, restrained lead vocal with almost-whispered verses and a clearer but unresolved chorus",
    "rights_notes": "New lyrics should be drafted from the approved brief, not copied from the source text.",
    "rationale": "New lyrics can preserve the source's emotional structure while becoming singable."
  },
  "arrangement_direction": {
    "target_duration_seconds": 120,
    "section_strategy": [
      {
        "section_name": "Intro",
        "beat_id": "beat_album_approach",
        "section_function": "Invitation",
        "tension_role": "establish the room without resolving it"
      },
      {
        "section_name": "Chorus",
        "beat_id": "beat_album_approach",
        "section_function": "Release",
        "tension_role": "state the unresolved emotional thesis without resolving it"
      }
    ],
    "dynamic_arc": "quiet invitation, tightening pressure, restrained release, unresolved final return",
    "ending_behavior": "end on an unresolved piano fragment and room tone"
  },
  "sonic_dynamics": {
    "active_sonic_tensions": [
      {
        "name": "Sparse / Dense",
        "tension_intensity": 0.65,
        "translation_notes": [
          "Keep the mix sparse while allowing pressure to accumulate."
        ]
      },
      {
        "name": "Resolved / Unresolved",
        "tension_intensity": 0.9,
        "translation_notes": [
          "Avoid clean cadences; let the ending remain suspended."
        ]
      }
    ],
    "genre_sonic_conflicts": [
      {
        "conflict": "Alt-R&B warmth could over-resolve the grief.",
        "adaptation": "Keep the vocal warm but hold harmony unresolved and leave negative space around the pulse.",
        "requires_artist_approval": false
      }
    ]
  },
  "sequence_plan": {
    "is_sequence": false,
    "requires_sequence_approval": false,
    "sequence_summary": "One compact song translates the single threshold beat."
  },
  "gates": {
    "sound_work_type_gate": "complete",
    "sonic_concept_gate": "complete",
    "genre_production_gate": "complete",
    "tempo_groove_gate": "complete",
    "vocal_lyric_gate": "complete",
    "arrangement_form_gate": "complete"
  },
  "review_requirements": {
    "beat_reviewer_required": true,
    "sound_critic_required": true,
    "prompt_critic_required": true
  },
  "traceability_summary": [
    {
      "source_type": "beat_plan",
      "source_ref": "bp_door_left_lit_album",
      "note": "The sound plan translates the shared threshold beat into section movement and unresolved harmonic pressure."
    }
  ]
}
